{
  "schema_version": "agent-runtime-proof/1.0",
  "proof_id": "sha256:cccccccccccccccccccccccccccccccccccccccccccccccccccccccccccccccc",
  "observed_at": "2026-08-24T06:30:00Z",
  "tool": {"name": "agent-runtime-proof", "version": "0.1.0", "commit": "0123456789abcdef", "toolchain": "go1.27.0"},
  "platform": {"os": "darwin", "arch": "arm64"},
  "subject": {"id": "com.example.runtime", "display_name": "Example Runtime", "version": "1.4.2"},
  "expectation": {
    "source_kind": "release-manifest",
    "source_locator_hash": "bbbbbbbbbbbbbbbbbbbbbbbbbbbbbbbbbbbbbbbbbbbbbbbbbbbbbbbbbbbbbbbb",
    "trust": "verified",
    "expected_version": "1.4.2",
    "expected_artifact_sha256": "aaaaaaaaaaaaaaaaaaaaaaaaaaaaaaaaaaaaaaaaaaaaaaaaaaaaaaaaaaaaaaaa"
  },
  "observation": {
    "process": {"pid": 4127, "created_at_unix_nano": "1787536210123456789", "boot_id_hash": "sha256:dddddddddddddddddddddddddddddddddddddddddddddddddddddddddddddddd"},
    "executable": {"basename": "example-runtime", "path_hash": "sha256:eeeeeeeeeeeeeeeeeeeeeeeeeeeeeeeeeeeeeeeeeeeeeeeeeeeeeeeeeeeeeeee", "file_id_hash": "sha256:ffffffffffffffffffffffffffffffffffffffffffffffffffffffffffffffff"},
    "artifact": {"sha256": "aaaaaaaaaaaaaaaaaaaaaaaaaaaaaaaaaaaaaaaaaaaaaaaaaaaaaaaaaaaaaaaa", "file_count": 12, "byte_count": 2048, "duration_ms": 17},
    "inaccessible_fields": []
  },
  "host_attribution": {"host_id": "generic-mcp", "config_source_hash": "sha256:9999999999999999999999999999999999999999999999999999999999999999", "confidence": "bound"},
  "verdict": "MATCHED",
  "proof_level": "ARTIFACT_OBSERVED",
  "reason_codes": ["MATCH_CONFIRMED"],
  "evidence": [
    {"type": "process_identity", "digest": "sha256:7777777777777777777777777777777777777777777777777777777777777777", "observed_at": "2026-08-24T06:30:00Z"},
    {"type": "artifact_digest", "digest": "sha256:aaaaaaaaaaaaaaaaaaaaaaaaaaaaaaaaaaaaaaaaaaaaaaaaaaaaaaaaaaaaaaaa", "observed_at": "2026-08-24T06:30:00Z"}
  ],
  "privacy": {"redaction_mode": "safe-default", "home_redacted": true, "omitted_fields": ["process.argv", "process.environment"]},
  "limitations": []
}
